{
  "$schema": "ihris-form-class/v1",
  "id": "ihris-common/form-class/CSD_Search",
  "class": "CSD_Search",
  "release": "4.3.3",
  "extends": "I2CE_Form",
  "forms": [],
  "definedIn": [
    "ihris-common/module/csd-search"
  ],
  "fields": [
    {
      "field": "start",
      "type": "INT",
      "label": "Start Record",
      "required": false,
      "unique": null,
      "references": null,
      "definedIn": [
        "ihris-common/module/csd-search"
      ]
    },
    {
      "field": "result",
      "type": "STRING_MLINE",
      "label": "Result",
      "required": false,
      "unique": null,
      "references": null,
      "definedIn": [
        "ihris-common/module/csd-search"
      ]
    },
    {
      "field": "max",
      "type": "INT",
      "label": "Maximum Number of Results",
      "required": false,
      "unique": null,
      "references": null,
      "definedIn": [
        "ihris-common/module/csd-search"
      ]
    },
    {
      "field": "updated",
      "type": "DATE_TIME",
      "label": "Updated",
      "required": false,
      "unique": null,
      "references": null,
      "definedIn": [
        "ihris-common/module/csd-search"
      ]
    }
  ]
}
